{
  "schemaVersion": "ruleoak.governance.v1",
  "recordType": "PolicyDecisionRecord",
  "decisionId": "conformance-decision-allow-001",
  "runId": "conformance-run-001",
  "action": "read.source_document",
  "subject": "policy://access-control-baseline",
  "effect": "allow",
  "matchedRuleIds": [
    "conformance.read.internal.allow"
  ],
  "reason": "Read-only access to internal conformance fixture is allowed.",
  "metadata": {
    "risk": "low"
  },
  "createdAt": "2026-01-01T00:00:00.000Z",
  "decision": "allowed"
}
