{
  "schemaVersion": "ruleoak.governance.v1",
  "recordType": "PolicyDecisionRecord",
  "decisionId": "conformance-decision-approval-001",
  "runId": "conformance-run-001",
  "action": "write.production_change",
  "subject": "service://checkout/threshold",
  "effect": "approval_required",
  "matchedRuleIds": [
    "conformance.write.production.approval"
  ],
  "reason": "Production write action requires human approval.",
  "metadata": {
    "risk": "medium"
  },
  "createdAt": "2026-01-01T00:00:00.000Z",
  "decision": "approval_required"
}
