{
  "schemaVersion": "ruleoak.governance.v1",
  "recordType": "PolicyDecisionRecord",
  "decisionId": "roak-decision-golden-001",
  "runId": "roak-run-golden-001",
  "action": "delete_workspace_file",
  "subject": "workspace-file",
  "effect": "deny",
  "matchedRuleIds": [
    "filesystem.deny_destructive"
  ],
  "reason": "Destructive filesystem actions are blocked.",
  "metadata": {},
  "createdAt": "2026-01-01T00:00:00.000Z"
}